<?xml version="1.0"?>
<!DOCTYPE alumni-system SYSTEM "proj.dtd">
<?xml-stylesheet type="text/xsl" href="proj.xsl" ?>

<alumni-system  xmlns:xsi="http://www.w3.org/2001/XMLSchema-instance" xsi:noNamespaceSchemaLocation="proj.xsd">

  <alumnus>
    <first-name> Geethesh </first-name>
    <last-name> TG </last-name>
    <username> tggeethesh </username>
    <position> Principal Engineer </position>
    <company> Versa Networks </company>
    <skillset> Deep Learning </skillset>
  </alumnus>
  
</alumni-system>